{
  "schema_version": "1.0",
  "collection_id": "fixture-malicious-001",
  "created_at": "2026-08-25T00:00:00Z",
  "consent": {
    "local_collection_confirmed": true,
    "llm_submission_confirmed": true,
    "purpose": "triagem defensiva do sintoma cmd.exe/PowerShell no boot",
    "provider_name": "mock-provider",
    "data_mode": "redacted",
    "retention_acknowledged": true,
    "recorded_at": "2026-08-25T00:00:00Z"
  },
  "host": {
    "os_family": "Windows",
    "os_version": "fixture",
    "build_number": "fixture",
    "architecture": "amd64",
    "hostname": "HOST-REDACTED",
    "interactive_user": "USER-REDACTED",
    "privilege_context": "administrator",
    "defender_present": true
  },
  "collection": {
    "started_at": "2026-08-25T00:00:00Z",
    "finished_at": "2026-08-25T00:00:12Z",
    "collector_version": "fixture",
    "categories_requested": ["processes", "persistence", "scheduled_tasks", "services", "wmi_subscriptions", "winlogon", "network", "defender_events"],
    "categories_completed": ["processes", "persistence", "scheduled_tasks", "services", "wmi_subscriptions", "winlogon", "network", "defender_events"],
    "read_only_assertion": true
  },
  "processes": [
    {
      "evidence_id": "ev-mal-proc1",
      "source": "process_snapshot",
      "observed_at": "2026-08-25T00:00:05Z",
      "sensitivity": "personal_possible",
      "redaction_status": "redacted",
      "pid": 8800,
      "parent_pid": 8700,
      "image_name": "powershell.exe",
      "image_path": "C:\\Users\\Public\\Temp\\fixture.ps1",
      "command_line": "powershell.exe -WindowStyle Hidden -File <fixture-script>",
      "start_time": "2026-08-25T00:00:04Z",
      "integrity_level": "high",
      "user": "USER-REDACTED",
      "signature": {"status": "unsigned", "publisher": null, "certificate_subject": null, "checked_at": "2026-08-25T00:00:06Z"},
      "sha256": "bbbbbbbbbbbbbbbbbbbbbbbbbbbbbbbbbbbbbbbbbbbbbbbbbbbbbbbbbbbbbbbb",
      "hash_status": "computed",
      "parent_evidence_id": "ev-mal-proc0"
    },
    {
      "evidence_id": "ev-mal-proc0",
      "source": "process_snapshot",
      "observed_at": "2026-08-25T00:00:05Z",
      "sensitivity": "personal_possible",
      "redaction_status": "redacted",
      "pid": 8700,
      "parent_pid": null,
      "image_name": "svchost.exe",
      "image_path": "C:\\Windows\\System32\\svchost.exe",
      "command_line": "svchost.exe -k netsvcs",
      "start_time": "2026-08-25T00:00:02Z",
      "integrity_level": "system",
      "user": "SYSTEM",
      "signature": {"status": "valid", "publisher": "Microsoft Corporation", "certificate_subject": "Microsoft Windows", "checked_at": "2026-08-25T00:00:06Z"},
      "sha256": null,
      "hash_status": "not_computed"
    }
  ],
  "persistence": {
    "run": [
      {
        "evidence_id": "ev-mal-run1",
        "source": "registry",
        "observed_at": "2026-08-25T00:00:05Z",
        "sensitivity": "personal_possible",
        "redaction_status": "redacted",
        "hive": "HKCU",
        "key_path": "Software\\Microsoft\\Windows\\CurrentVersion\\Run",
        "value_name": "SystemHealthFixture",
        "value_data": "C:\\Users\\Public\\Temp\\fixture-loader.exe /silent",
        "scope": "user"
      }
    ],
    "run_once": []
  },
  "scheduled_tasks": {
    "status": "complete",
    "items": [
      {
        "evidence_id": "ev-mal-task1",
        "source": "task_scheduler",
        "observed_at": "2026-08-25T00:00:05Z",
        "sensitivity": "personal_possible",
        "redaction_status": "redacted",
        "task_path": "\\Update\\Maintenance",
        "task_name": "SystemMaintenanceFixture",
        "author": null,
        "description": null,
        "state": "ready",
        "triggers": [{"type": "at_logon", "hidden": true}],
        "actions": [{"type": "exec", "path": "C:\\Users\\Public\\Temp\\fixture-loader.exe", "arguments": "/silent"}],
        "principal": "SYSTEM",
        "run_level": "highest_available",
        "registered_at": "2026-08-24T23:59:00Z"
      }
    ]
  },
  "services": {"status": "complete", "items": []},
  "wmi_subscriptions": {
    "status": "complete",
    "items": [{
      "evidence_id": "ev-mal-wmi1",
      "source": "wmi_repository",
      "observed_at": "2026-08-25T00:00:05Z",
      "sensitivity": "personal_possible",
      "redaction_status": "redacted",
      "namespace": "root\\subscription",
      "filter_name": "FixtureFilter",
      "consumer_name": "FixtureConsumer",
      "binding_name": "FixtureBinding",
      "creator": "USER-REDACTED",
      "event_query": "<fixture-query-redacted>",
      "created_at": "2026-08-24T23:58:00Z"
    }]
  },
  "winlogon": {"status": "complete", "items": []},
  "network": {
    "status": "complete",
    "tcp_connections": [{
      "evidence_id": "ev-mal-net1",
      "source": "iphlpapi",
      "observed_at": "2026-08-25T00:00:05Z",
      "sensitivity": "personal_possible",
      "redaction_status": "redacted",
      "protocol": "tcp4",
      "local_address": "192.0.2.10",
      "local_port": 50123,
      "remote_address": "198.51.100.20",
      "remote_port": 443,
      "state": "ESTABLISHED",
      "owning_pid": 8800,
      "owning_image": "C:\\Users\\Public\\Temp\\fixture.ps1"
    }],
    "udp_endpoints": []
  },
  "defender_events": {
    "status": "complete",
    "items": [{
      "evidence_id": "ev-mal-def1",
      "source": "defender_event_log",
      "observed_at": "2026-08-25T00:00:05Z",
      "sensitivity": "personal_possible",
      "redaction_status": "redacted",
      "log_name": "Microsoft-Windows-Windows Defender/Operational",
      "provider": "Microsoft-Windows-Windows Defender",
      "event_id": 1116,
      "level": "warning",
      "timestamp": "2026-08-25T00:00:03Z",
      "message": "<fixture-detection-message-redacted>",
      "action": "detected",
      "threat_name": "Fixture.Suspicious.Script",
      "category": "fixture"
    }]
  },
  "limitations": [],
  "integrity": {"canonicalization": "RFC8785-compatible-json-canonicalization", "sha256": "bbbbbbbbbbbbbbbbbbbbbbbbbbbbbbbbbbbbbbbbbbbbbbbbbbbbbbbbbbbbbbbb", "read_only_assertion": true, "signing_key_id": null}
}
